name,pan,total_profit_crore,index_options_profit_crore,index_futures_profit_crore,stock_options_profit_crore,stock_futures_profit_crore,cash_segment_profit_crore
Jane Street Asia Trading Limited,AAECJ7368M,6929.56,7650.34,-85.62,34.82,-668.87,-1.12
JSI2 Investments Private Limited,AAGCJ5786R,-168.67,-168.67,,,,
JSI Investments Private Limited,AAFCJ0285L,4104.61,4392.03,0.0,-0.37,0.0,-287.05
Jane Street Singapore Pte Limited,AAGCJ1682G,25636.62,31415.63,-105.19,865.54,-6539.36,0.0
Total,,36502.12,43289.33,-190.81,899.99,-7208.23,-288.17
